Client,Title,Artist,Date,Time,Target Audience,Type,Category
Mousetrap Heart Events, Thirsty Merc in the Summertime, Thirsty Merc, 20-12-24, 8pm,2000, gig, indoor
Party People United, New Years Eve Rock and Dance Gigs, Various local musicians, 31-12-24, 8pm,1000, gig, indoor
Party People United, BBQ and Udon Winter Festival, Jap Jazz, 1-6-24, 12pm,4000, gig, outdoor
Macca Production, World Peace for Yoko, Paul McCartney, 2-2-25, 12pm,35000, large live concert, outdoor
Taytay Production, 1989 Tour Again, Taylor Swift, 5-4-25, 7pm,90000, large live concert, convertible
